{
  "id": "proc_purchase",
  "name": "Проведение закупки",
  "level": "L2",
  "parent": "proc_procurement",
  "owner": "Отдел закупок",
  "pool": "ООО «Альфа-Пример»",
  "lanes": [
    { "id": "ln_init", "name": "Инициатор" },
    { "id": "ln_head", "name": "Руководитель подразделения" },
    { "id": "ln_fin", "name": "Финансовый отдел" },
    { "id": "ln_proc", "name": "Отдел закупок" }
  ],
  "nodes": [
    { "id": "s1", "type": "startEvent", "name": "Возникла потребность в продукции", "lane": "ln_init", "confidence": "inferred" },
    { "id": "t_request", "type": "userTask", "name": "Оформить заявку на закупку", "lane": "ln_init", "system": "СЭД",
      "documents": [{ "name": "Заявка на закупку", "direction": "out" }],
      "source": { "doc": "reglament-zakupok.md", "section": "S3.1", "quote": "заявка Инициатора, оформленная в СЭД" } },
    { "id": "t_review", "type": "userTask", "name": "Рассмотреть заявку", "lane": "ln_head", "sla": "2 рабочих дня (п. 3.2) / 3 рабочих дня (Прил. 1) — см. G1",
      "source": { "doc": "reglament-zakupok.md", "section": "S3.2", "quote": "Руководитель подразделения рассматривает заявку в течение 2 рабочих дней" } },
    { "id": "g_approved", "type": "exclusiveGateway", "name": "Заявка согласована?", "lane": "ln_head",
      "source": { "doc": "reglament-zakupok.md", "section": "S3.2" } },
    { "id": "e_rejected_head", "type": "endEvent", "name": "Заявка возвращена Инициатору", "lane": "ln_init",
      "source": { "doc": "reglament-zakupok.md", "section": "S3.2", "quote": "При отклонении заявка возвращается Инициатору с комментарием" } },
    { "id": "t_budget", "type": "userTask", "name": "Проверить бюджетный лимит", "lane": "ln_fin", "system": "1С:ERP", "sla": "1 рабочий день",
      "source": { "doc": "reglament-zakupok.md", "section": "S3.3", "quote": "проверяет наличие бюджетного лимита в 1С:ERP" } },
    { "id": "g_budget", "type": "exclusiveGateway", "name": "Лимит есть?", "lane": "ln_fin",
      "source": { "doc": "reglament-zakupok.md", "section": "S3.3" } },
    { "id": "e_rejected_budget", "type": "endEvent", "name": "Заявка отклонена: нет лимита", "lane": "ln_fin",
      "source": { "doc": "reglament-zakupok.md", "section": "S3.3", "quote": "При отсутствии лимита заявка отклоняется" } },
    { "id": "t_method", "type": "userTask", "name": "Определить способ закупки", "lane": "ln_proc",
      "source": { "doc": "reglament-zakupok.md", "section": "S3.4", "quote": "Отдел закупок определяет способ закупки" } },
    { "id": "g_method", "type": "exclusiveGateway", "name": "Стоимость свыше 500 000 руб.?", "lane": "ln_proc",
      "source": { "doc": "reglament-zakupok.md", "section": "S3.4" } },
    { "id": "c_rfq", "type": "callActivity", "name": "Провести запрос котировок", "lane": "ln_proc", "ref": "proc_rfq",
      "source": { "doc": "reglament-zakupok.md", "section": "S3.5", "quote": "выбирает предложение с наименьшей ценой" } },
    { "id": "c_tender", "type": "callActivity", "name": "Провести тендер", "lane": "ln_proc", "ref": "proc_tender",
      "source": { "doc": "reglament-zakupok.md", "section": "S3.6" } },
    { "id": "b_tender_failed", "type": "boundaryEvent", "event": "error", "code": "TENDER_FAILED", "attachedTo": "c_tender", "name": "Тендер не состоялся",
      "source": { "doc": "reglament-zakupok.md", "section": "S3.7", "quote": "тендер признаётся несостоявшимся" } },
    { "id": "e_tender_failed", "type": "endEvent", "name": "Закупка не состоялась", "lane": "ln_proc", "confidence": "assumption",
      "notes": "Дальнейшие действия не описаны — см. G2" },
    { "id": "g_merge", "type": "exclusiveGateway", "lane": "ln_proc" },
    { "id": "t_draft", "type": "userTask", "name": "Подготовить проект договора", "lane": "ln_proc",
      "documents": [{ "name": "Проект договора", "direction": "out" }],
      "source": { "doc": "reglament-zakupok.md", "section": "S3.8", "quote": "Отдел закупок готовит проект договора" } },
    { "id": "e_done", "type": "endEvent", "name": "Проект договора подготовлен", "lane": "ln_proc", "confidence": "inferred" }
  ],
  "flows": [
    { "id": "f1", "from": "s1", "to": "t_request" },
    { "id": "f2", "from": "t_request", "to": "t_review" },
    { "id": "f3", "from": "t_review", "to": "g_approved" },
    { "id": "f4", "from": "g_approved", "to": "t_budget", "name": "Да", "expression": "approved = true" },
    { "id": "f5", "from": "g_approved", "to": "e_rejected_head", "name": "Нет", "default": true },
    { "id": "f6", "from": "t_budget", "to": "g_budget" },
    { "id": "f7", "from": "g_budget", "to": "t_method", "name": "Да", "expression": "budgetAvailable = true" },
    { "id": "f8", "from": "g_budget", "to": "e_rejected_budget", "name": "Нет", "default": true },
    { "id": "f9", "from": "t_method", "to": "g_method" },
    { "id": "f10", "from": "g_method", "to": "c_rfq", "name": "Нет", "default": true },
    { "id": "f11", "from": "g_method", "to": "c_tender", "name": "Да", "expression": "amount > 500000" },
    { "id": "f12", "from": "c_rfq", "to": "g_merge" },
    { "id": "f13", "from": "c_tender", "to": "g_merge" },
    { "id": "f14", "from": "g_merge", "to": "t_draft" },
    { "id": "f15", "from": "t_draft", "to": "e_done" },
    { "id": "f16", "from": "b_tender_failed", "to": "e_tender_failed" }
  ],
  "gaps": [
    { "id": "G1", "severity": "high", "node": "t_review", "text": "Срок рассмотрения: 2 рабочих дня (п. 3.2) против 3 рабочих дней (Приложение 1)", "question": "Какой срок действует?",
      "source": { "doc": "reglament-zakupok.md", "section": "A1", "quote": "Рассмотрение заявки | Руководитель подразделения | 3 рабочих дня" } },
    { "id": "G2", "severity": "high", "node": "e_tender_failed", "text": "Нет порядка действий при несостоявшемся тендере", "question": "Повторный тендер, единственный поставщик или отмена? Кто решает?" },
    { "id": "G3", "severity": "medium", "node": "e_rejected_budget", "text": "Не описано уведомление Инициатора и возможность перераспределить лимит", "question": "Кто уведомляет Инициатора? Есть ли перераспределение лимита?" },
    { "id": "G8", "severity": "low", "node": "e_rejected_head", "text": "Не описана повторная подача после доработки", "question": "Инициатор дорабатывает ту же заявку или создаёт новую?" }
  ]
}
